{
  "schemaVersion": 1,
  "generated": "2026-06-27",
  "electionId": "2026-06-02-primary",
  "source": {
    "kind": "url",
    "value": "https://www.contracostavote.gov/wp-content/uploads/20260602_ContraCostaSOV_ByPCT_LVTP.xlsx"
  },
  "run": {
    "startedAt": "2026-06-27T04:23:04.477290+00:00",
    "generatedAt": "2026-06-27T04:23:29.766437+00:00"
  }
}
