{
  "schemaVersion": 1,
  "generated": "2026-06-29",
  "electionId": "2026-06-02-primary",
  "source": {
    "kind": "url",
    "value": "https://acvote.alamedacountyca.gov/acvote-assets/02_election_information/PDFs/20260602/Results/PrecinctCanvassJun02.xlsx"
  },
  "run": {
    "startedAt": "2026-06-29T03:20:23.438894+00:00",
    "generatedAt": "2026-06-29T03:20:37.214478+00:00"
  }
}
